<?xml version="1.0" encoding="UTF-8"?>
<!DOCTYPE abatorConfiguration
  PUBLIC "-//Apache Software Foundation//DTD Abator for iBATIS Configuration 1.0//EN"
  "http://ibatis.apache.org/dtd/abator-config_1_0.dtd">

<abatorConfiguration>
  
  <abatorContext generatorSet="Java2" defaultModelType="flat">
    <jdbcConnection driverClass="org.hsqldb.jdbcDriver"
        connectionURL="jdbc:hsqldb:mem:aname"
        userId="sa" />

    <javaModelGenerator targetPackage="abatortest.java2.generated.flat.java2.model" targetProject="${generated.source.dir.java2}">
      <property name="enableSubPackages" value="true" />
      <property name="trimStrings" value="true" />
    </javaModelGenerator>

    <sqlMapGenerator targetPackage="abatortest.java2.generated.flat.java2.xml"  targetProject="${generated.source.dir.java2}">
      <property name="enableSubPackages" value="true" />
    </sqlMapGenerator>

    <daoGenerator type="GENERIC-CI" targetPackage="abatortest.java2.generated.flat.java2.dao"  targetProject="${generated.source.dir.java2}">
      <property name="enableSubPackages" value="true" />
    </daoGenerator>

    <table tableName="FieldsOnly" />
    <table tableName="PKOnly" />
    <table tableName="PKFields" />
    <table tableName="PKBlobs" />
    <table tableName="PKFieldsBlobs" />
    <table tableName="FieldsBlobs" />
    <table tableName="awful table" alias="A">
      <property name="useColumnIndexes" value="true"/>
      <generatedKey column="CuStOmEr iD" sqlStatement="HSQLDB" identity="true" />
      <columnOverride column="customer id" property="secondCustomerId" />
      <columnOverride column="first name" property="firstFirstName" />
      <columnOverride column="First Name" property="secondFirstName" />
      <ignoreColumn column="first Name" />
      <columnOverride column="first_name" property="thirdFirstName" />
      <columnOverride column="firstName" property="fourthFirstName" />
      <columnOverride column="from" delimitedColumnName="true" />
    </table>
  </abatorContext>

  <abatorContext generatorSet="Legacy" defaultModelType="flat">
    <jdbcConnection driverClass="org.hsqldb.jdbcDriver"
        connectionURL="jdbc:hsqldb:mem:aname"
        userId="sa" />

    <javaModelGenerator targetPackage="abatortest.java2.generated.flat.legacy.model" targetProject="${generated.source.dir.java2}">
      <property name="enableSubPackages" value="true" />
      <property name="trimStrings" value="true" />
    </javaModelGenerator>

    <sqlMapGenerator targetPackage="abatortest.java2.generated.flat.legacy.xml"  targetProject="${generated.source.dir.java2}">
      <property name="enableSubPackages" value="true" />
    </sqlMapGenerator>

    <daoGenerator type="GENERIC-CI" targetPackage="abatortest.java2.generated.flat.legacy.dao"  targetProject="${generated.source.dir.java2}">
      <property name="enableSubPackages" value="true" />
    </daoGenerator>

    <table tableName="FieldsOnly" />
    <table tableName="PKOnly" />
    <table tableName="PKFields" />
    <table tableName="PKBlobs" />
    <table tableName="PKFieldsBlobs" />
    <table tableName="FieldsBlobs" />
    <table tableName="awful table" alias="A">
      <property name="useColumnIndexes" value="true"/>
      <generatedKey column="CuStOmEr iD" sqlStatement="HSQLDB" identity="true" />
      <columnOverride column="customer id" property="secondCustomerId" />
      <columnOverride column="first name" property="firstFirstName" />
      <columnOverride column="First Name" property="secondFirstName" />
      <ignoreColumn column="first Name" />
      <columnOverride column="first_name" property="thirdFirstName" />
      <columnOverride column="firstName" property="fourthFirstName" />
      <columnOverride column="from" delimitedColumnName="true" />
    </table>
  </abatorContext>

  <abatorContext generatorSet="Java2" defaultModelType="hierarchical">
    <jdbcConnection driverClass="org.hsqldb.jdbcDriver"
        connectionURL="jdbc:hsqldb:mem:aname"
        userId="sa" />

    <javaModelGenerator targetPackage="abatortest.java2.generated.hierarchical.java2.model" targetProject="${generated.source.dir.java2}">
      <property name="enableSubPackages" value="true" />
      <property name="trimStrings" value="true" />
    </javaModelGenerator>

    <sqlMapGenerator targetPackage="abatortest.java2.generated.hierarchical.java2.xml"  targetProject="${generated.source.dir.java2}">
      <property name="enableSubPackages" value="true" />
    </sqlMapGenerator>

    <daoGenerator type="GENERIC-CI" targetPackage="abatortest.java2.generated.hierarchical.java2.dao"  targetProject="${generated.source.dir.java2}">
      <property name="enableSubPackages" value="true" />
    </daoGenerator>

    <table tableName="FieldsOnly" />
    <table tableName="PKOnly" />
    <table tableName="PKFields" />
    <table tableName="PKBlobs" />
    <table tableName="PKFieldsBlobs" />
    <table tableName="FieldsBlobs" />
    <table tableName="awful table" alias="A">
      <property name="useColumnIndexes" value="true"/>
      <generatedKey column="CuStOmEr iD" sqlStatement="HSQLDB" identity="true" />
      <columnOverride column="customer id" property="secondCustomerId" />
      <columnOverride column="first name" property="firstFirstName" />
      <columnOverride column="First Name" property="secondFirstName" />
      <ignoreColumn column="first Name" />
      <columnOverride column="first_name" property="thirdFirstName" />
      <columnOverride column="firstName" property="fourthFirstName" />
      <columnOverride column="from" delimitedColumnName="true" />
    </table>
  </abatorContext>

  <abatorContext generatorSet="Legacy" defaultModelType="hierarchical">
    <jdbcConnection driverClass="org.hsqldb.jdbcDriver"
        connectionURL="jdbc:hsqldb:mem:aname"
        userId="sa" />

    <javaModelGenerator targetPackage="abatortest.java2.generated.hierarchical.legacy.model" targetProject="${generated.source.dir.java2}">
      <property name="enableSubPackages" value="true" />
      <property name="trimStrings" value="true" />
    </javaModelGenerator>

    <sqlMapGenerator targetPackage="abatortest.java2.generated.hierarchical.legacy.xml"  targetProject="${generated.source.dir.java2}">
      <property name="enableSubPackages" value="true" />
    </sqlMapGenerator>

    <daoGenerator type="GENERIC-CI" targetPackage="abatortest.java2.generated.hierarchical.legacy.dao"  targetProject="${generated.source.dir.java2}">
      <property name="enableSubPackages" value="true" />
    </daoGenerator>

    <table tableName="FieldsOnly" />
    <table tableName="PKOnly" />
    <table tableName="PKFields" />
    <table tableName="PKBlobs" />
    <table tableName="PKFieldsBlobs" />
    <table tableName="FieldsBlobs" />
    <table tableName="awful table" alias="A">
      <property name="useColumnIndexes" value="true"/>
      <generatedKey column="CuStOmEr iD" sqlStatement="HSQLDB" identity="true" />
      <columnOverride column="customer id" property="secondCustomerId" />
      <columnOverride column="first name" property="firstFirstName" />
      <columnOverride column="First Name" property="secondFirstName" />
      <ignoreColumn column="first Name" />
      <columnOverride column="first_name" property="thirdFirstName" />
      <columnOverride column="firstName" property="fourthFirstName" />
      <columnOverride column="from" delimitedColumnName="true" />
    </table>
  </abatorContext>

  <abatorContext generatorSet="Java2" defaultModelType="conditional">
    <jdbcConnection driverClass="org.hsqldb.jdbcDriver"
        connectionURL="jdbc:hsqldb:mem:aname"
        userId="sa" />

    <javaModelGenerator targetPackage="abatortest.java2.generated.conditional.java2.model" targetProject="${generated.source.dir.java2}">
      <property name="enableSubPackages" value="true" />
      <property name="trimStrings" value="true" />
    </javaModelGenerator>

    <sqlMapGenerator targetPackage="abatortest.java2.generated.conditional.java2.xml"  targetProject="${generated.source.dir.java2}">
      <property name="enableSubPackages" value="true" />
    </sqlMapGenerator>

    <daoGenerator type="GENERIC-CI" targetPackage="abatortest.java2.generated.conditional.java2.dao"  targetProject="${generated.source.dir.java2}">
      <property name="enableSubPackages" value="true" />
    </daoGenerator>

    <table tableName="FieldsOnly" />
    <table tableName="PKOnly" />
    <table tableName="PKFields" />
    <table tableName="PKBlobs" />
    <table tableName="PKFieldsBlobs" />
    <table tableName="FieldsBlobs" />
    <table tableName="awful table" alias="A">
      <property name="useColumnIndexes" value="true"/>
      <generatedKey column="CuStOmEr iD" sqlStatement="HSQLDB" identity="true" />
      <columnOverride column="customer id" property="secondCustomerId" />
      <columnOverride column="first name" property="firstFirstName" />
      <columnOverride column="First Name" property="secondFirstName" />
      <ignoreColumn column="first Name" />
      <columnOverride column="first_name" property="thirdFirstName" />
      <columnOverride column="firstName" property="fourthFirstName" />
      <columnOverride column="from" delimitedColumnName="true" />
    </table>
  </abatorContext>

  <abatorContext generatorSet="Legacy" defaultModelType="conditional">
    <jdbcConnection driverClass="org.hsqldb.jdbcDriver"
        connectionURL="jdbc:hsqldb:mem:aname"
        userId="sa" />

    <javaModelGenerator targetPackage="abatortest.java2.generated.conditional.legacy.model" targetProject="${generated.source.dir.java2}">
      <property name="enableSubPackages" value="true" />
      <property name="trimStrings" value="true" />
    </javaModelGenerator>